{
  "asserted_by": {
    "id": "codex",
    "kind": "agent"
  },
  "evidence": [],
  "extensions": {
    "skills-workshop/session": "01a0d49a-f57e-76a0-a7be-05b2be272483"
  },
  "id": "urn:uuid:97a530fd-7c6e-4b7b-a5e2-a5d277b878b7",
  "occurred_at": "2026-09-24T18:11:17Z",
  "payload": {
    "benefit": "better-result",
    "invocation": "unknown",
    "listing_state": "unknown",
    "outcome": "success",
    "rationale": "Captured formatting and skill validation logs outside the repository.",
    "task_summary": "Validate draft PR policy skill update"
  },
  "project_evidence": {
    "apm_version": null,
    "command": [
      "scan",
      ".agents/skills"
    ],
    "dependency_selector": null,
    "dirty": true,
    "lock_digest": null,
    "lock_path": null,
    "manifest_path": null,
    "project_id": "urn:uuid:7bea25b4-8855-4e71-a079-ae079a72c0c6",
    "repository_commit": "60b707cabd357f83fdc06cab66f9245961c961d5"
  },
  "recorded_by": {
    "tool": "skills-workshop",
    "version": "0.1.0"
  },
  "review": {
    "state": "unreviewed"
  },
  "schema": "https://github.com/leej3/skills-workshop/schemas/memory/event-v0.schema.json",
  "skill_id": "urn:uuid:840a82de-0189-4a74-a0aa-5e75b212e16a",
  "type": "use"
}
