{
  "asserted_by": {
    "id": "project-tree",
    "kind": "tool",
    "runtime": "agent-skills"
  },
  "evidence": [],
  "extensions": {},
  "id": "urn:uuid:fb5bd092-ff0a-48bb-b9de-d98c2da3416e",
  "occurred_at": "2026-09-24T22:24:47Z",
  "payload": {
    "resolution_digest": "sha256:b2068f87ce3867aff9c917fcb4f422ff7b2a51b6aa7eb4cd480cd3d4904067fd",
    "skill_name": "skills-workshop",
    "state": "resolved"
  },
  "project_evidence": {
    "apm_version": "0.31.0",
    "command": [
      "apm",
      "deps",
      "list"
    ],
    "dependency_selector": ".agents/skills/skills-workshop",
    "dirty": true,
    "lock_digest": "sha256:b669dce2b67f10446136948c0049fe6fa85d38c11ae8bf751d949e64a7edd638",
    "lock_path": "apm.lock.yaml",
    "manifest_path": "apm.yml",
    "project_id": "urn:uuid:7bea25b4-8855-4e71-a079-ae079a72c0c6",
    "repository_commit": "fca2a6e35f64e5584afe15992430ab782f7c8f36"
  },
  "recorded_by": {
    "tool": "skills-workshop",
    "version": "0.1.0"
  },
  "review": {
    "state": "unreviewed"
  },
  "schema": "https://github.com/leej3/skills-workshop/schemas/memory/event-v0.schema.json",
  "skill_id": "urn:uuid:7a5c0e4c-078e-4832-9e6d-f5c4ff0298e4",
  "type": "project-membership"
}
