{
  "asserted_by": {
    "id": "project-tree",
    "kind": "tool",
    "runtime": "agent-skills"
  },
  "evidence": [],
  "extensions": {},
  "id": "urn:uuid:696dcaa3-2826-4ce7-adac-e6e1fcbd6321",
  "occurred_at": "2026-09-03T19:22:33Z",
  "payload": {
    "resolution_digest": "sha256:ad8a7666063e994c4b0dc779003bc8d27852fc77df6ae200758bbe40aae5bc46",
    "skill_name": "commit-provenance",
    "state": "resolved"
  },
  "project_evidence": {
    "apm_version": null,
    "command": [
      "scan",
      ".agents/skills"
    ],
    "dependency_selector": ".agents/skills/commit-provenance",
    "dirty": true,
    "lock_digest": null,
    "lock_path": null,
    "manifest_path": null,
    "project_id": "urn:uuid:4e3a79eb-dd6f-4e2c-b60c-4de70dcdb2e5",
    "repository_commit": "19a46a5db4d4054455543dac3b51719c74a140ad"
  },
  "recorded_by": {
    "tool": "skills-workshop",
    "version": "0.1.0"
  },
  "review": {
    "state": "unreviewed"
  },
  "schema": "https://github.com/leej3/skills-workshop/schemas/memory/event-v0.schema.json",
  "skill_id": "urn:uuid:b772464b-dc4c-49bb-b3c1-903e1b87c29a",
  "type": "project-membership"
}
