{
  "asserted_by": {
    "id": "apm-lock",
    "kind": "tool",
    "runtime": "apm",
    "runtime_version": "0.31.0"
  },
  "evidence": [],
  "extensions": {},
  "id": "urn:uuid:8b9c8911-581e-47c1-b66a-a29bc76c0eb1",
  "occurred_at": "2026-09-30T22:30:13Z",
  "payload": {
    "resolution_digest": "sha256:601ad411590e8368a76275540851b0421aa399eea6d47de998bdac86d82e860d",
    "skill_name": "autoharness-reflect",
    "state": "resolved"
  },
  "project_evidence": {
    "apm_version": "0.31.0",
    "command": [
      "apm",
      "deps",
      "list"
    ],
    "dependency_selector": "leej3/autoharness#skill=autoharness-reflect",
    "dirty": true,
    "lock_digest": "sha256:2144d6fc4d96d3f594813138c081abe88b84f259583fb665adcbf94afa9849b0",
    "lock_path": "apm.lock.yaml",
    "manifest_path": "apm.yml",
    "project_id": "urn:uuid:7bea25b4-8855-4e71-a079-ae079a72c0c6",
    "repository_commit": "f8cd232c4abe75e53660f60f7d75fe8fb68430d5"
  },
  "recorded_by": {
    "tool": "skills-workshop",
    "version": "0.1.0"
  },
  "review": {
    "state": "unreviewed"
  },
  "schema": "https://github.com/leej3/skills-workshop/schemas/memory/event-v0.schema.json",
  "skill_id": "urn:uuid:6f748d9e-1153-48ff-9d11-0028ee368823",
  "type": "project-membership"
}
