{
  "asserted_by": {
    "id": "project-tree",
    "kind": "tool",
    "runtime": "agent-skills"
  },
  "evidence": [],
  "extensions": {},
  "id": "urn:uuid:5f6c4197-6ed2-4260-bc03-d3990ea7512e",
  "occurred_at": "2026-09-23T20:04:49Z",
  "payload": {
    "resolution_digest": "sha256:7693318b3402e291a88fc852c4497f0d40ec500a703202c9bda8e040972535f8",
    "skill_name": "review-terminology",
    "state": "resolved"
  },
  "project_evidence": {
    "apm_version": "0.29.0",
    "command": [
      "apm",
      "deps",
      "list"
    ],
    "dependency_selector": ".agents/skills/review-terminology",
    "dirty": true,
    "lock_digest": "sha256:9a92690155fb4debb3595cf1dbba0de19a5ad111d8a532ebeef8767317d225be",
    "lock_path": "apm.lock.yaml",
    "manifest_path": "apm.yml",
    "project_id": "urn:uuid:4e3a79eb-dd6f-4e2c-b60c-4de70dcdb2e5",
    "repository_commit": "d000d47d8980cca6762c3350a483004a2cef5135"
  },
  "recorded_by": {
    "tool": "skills-workshop",
    "version": "0.1.0"
  },
  "review": {
    "state": "unreviewed"
  },
  "schema": "https://github.com/leej3/skills-workshop/schemas/memory/event-v0.schema.json",
  "skill_id": "urn:uuid:9ef5bc9b-ab86-4790-b0e2-8f64c5c31b5d",
  "type": "project-membership"
}
