{
  "asserted_by": {
    "id": "codex",
    "kind": "agent"
  },
  "evidence": [
    {
      "kind": "url",
      "locator": "https://github.com/ORINOCO-Lite/orinoco-lite-dev/pull/177"
    }
  ],
  "extensions": {
    "skills-workshop/entrypoint": {
      "repository_revision": "3242f088cd4cf052cf9cb6de99e8ebd3ebc4e54c",
      "scope": "SKILL.md only",
      "sha256": "354242452b74d6b8f0c4f2245cbe031d844c091bb2d4d2adca05f1364fbe9d10"
    },
    "skills-workshop/session": "01a0cacd-2ce8-7563-8ed8-7448503b1111"
  },
  "id": "urn:uuid:b49932f2-dcb3-481b-96e7-437403fb679c",
  "occurred_at": "2026-09-23T00:10:19Z",
  "payload": {
    "benefit": "avoided-error",
    "invocation": "unknown",
    "listing_state": "unknown",
    "outcome": "success",
    "rationale": "Separated supplied-byte ingestion from recorded transformations and verified clean replay plus byte-identical reconstruction of a fresh capture.",
    "task_summary": "Split downstream preparation from RDF review"
  },
  "project_evidence": {
    "apm_version": "0.29.0",
    "command": [
      "apm",
      "deps",
      "list"
    ],
    "dependency_selector": null,
    "dirty": true,
    "lock_digest": "sha256:9a92690155fb4debb3595cf1dbba0de19a5ad111d8a532ebeef8767317d225be",
    "lock_path": "apm.lock.yaml",
    "manifest_path": "apm.yml",
    "project_id": "urn:uuid:4e3a79eb-dd6f-4e2c-b60c-4de70dcdb2e5",
    "repository_commit": "fbf366dff5cb56c002d39e8c877dcf793f4f0389"
  },
  "recorded_by": {
    "tool": "skills-workshop",
    "version": "0.1.0"
  },
  "review": {
    "state": "unreviewed"
  },
  "schema": "https://github.com/leej3/skills-workshop/schemas/memory/event-v0.schema.json",
  "skill_id": "urn:uuid:3e93f560-6e7f-45b4-a12f-6bcd68456bf1",
  "type": "use"
}
