{
  "asserted_by": {
    "id": "codex",
    "kind": "agent"
  },
  "evidence": [],
  "extensions": {
    "skills-workshop/session": "01a0cfc7-cb3c-7ae2-afc5-71fa24975ab6"
  },
  "id": "urn:uuid:ac469340-f036-4bd8-afbb-c585c5957468",
  "occurred_at": "2026-09-24T13:25:24Z",
  "payload": {
    "benefit": "avoided-error",
    "invocation": "unknown",
    "listing_state": "unknown",
    "outcome": "success",
    "rationale": "Cross-provider discovery found patch ownership and approval skills; full previews exposed repository-specific dependencies and deliberate-divergence skipping. Established DEP-3 patch practice plus pytest outcomes fit better than any single candidate.",
    "task_summary": "Discover established upstream difference maintenance practices"
  },
  "project_evidence": {
    "apm_version": "0.29.0",
    "command": [
      "apm",
      "deps",
      "list"
    ],
    "dependency_selector": null,
    "dirty": true,
    "lock_digest": "sha256:9a92690155fb4debb3595cf1dbba0de19a5ad111d8a532ebeef8767317d225be",
    "lock_path": "apm.lock.yaml",
    "manifest_path": "apm.yml",
    "project_id": "urn:uuid:4e3a79eb-dd6f-4e2c-b60c-4de70dcdb2e5",
    "repository_commit": "31bf10e4fe68cd45e69b5cb50ddc1c6bcc987d96"
  },
  "recorded_by": {
    "tool": "skills-workshop",
    "version": "0.1.0"
  },
  "review": {
    "state": "unreviewed"
  },
  "schema": "https://github.com/leej3/skills-workshop/schemas/memory/event-v0.schema.json",
  "skill_id": "urn:uuid:7a5c0e4c-078e-4832-9e6d-f5c4ff0298e4",
  "type": "use"
}
