{
  "asserted_by": {
    "id": "codex",
    "kind": "agent"
  },
  "evidence": [],
  "extensions": {},
  "id": "urn:uuid:6b085bae-589b-4af1-bfa9-abf3a421bd52",
  "occurred_at": "2026-08-30T13:52:19Z",
  "payload": {
    "invocation": "explicit",
    "listing_state": "manual-only",
    "outcome": "success",
    "rating": 5,
    "rationale": "The workflow distinguished the global control entry point from APM-managed project skill state and recorded the durable policy.",
    "scale_id": "workshop-overall-v1",
    "task_summary": "Established the user-level control-skill bootstrap and documented project-scoped installation"
  },
  "project_evidence": {
    "apm_version": "0.28.0",
    "command": [
      "apm",
      "deps",
      "list"
    ],
    "dependency_selector": null,
    "dirty": true,
    "lock_digest": "sha256:2246dec5c9228c54dd47cbd8e5ff919c0606731e81615ef3bea3f0211f2a75e5",
    "lock_path": "apm.lock.yaml",
    "manifest_path": "apm.yml",
    "project_id": "urn:uuid:7bea25b4-8855-4e71-a079-ae079a72c0c6",
    "repository_commit": "d10b3ca05bcc2f518145c17704a5d76415244b55"
  },
  "recorded_by": {
    "tool": "skills-workshop",
    "version": "0.1.0"
  },
  "review": {
    "state": "unreviewed"
  },
  "schema": "https://github.com/leej3/skills-workshop/schemas/memory/event-v0.schema.json",
  "skill_id": "urn:uuid:7a5c0e4c-078e-4832-9e6d-f5c4ff0298e4",
  "type": "use"
}
