{
  "asserted_by": {
    "id": "project-tree",
    "kind": "tool",
    "runtime": "agent-skills"
  },
  "evidence": [],
  "extensions": {},
  "id": "urn:uuid:f3fef0f7-06c3-4e1d-8446-19c0017484b4",
  "occurred_at": "2026-09-24T17:20:21Z",
  "payload": {
    "resolution_digest": "sha256:9185e257617799ee04cd08a67ccd941f5d83192f20f15c616c7433859db6e415",
    "skill_name": "workshop-feedback",
    "state": "resolved"
  },
  "project_evidence": {
    "apm_version": null,
    "command": [
      "scan",
      ".agents/skills"
    ],
    "dependency_selector": ".agents/skills/workshop-feedback",
    "dirty": true,
    "lock_digest": null,
    "lock_path": null,
    "manifest_path": null,
    "project_id": "urn:uuid:7bea25b4-8855-4e71-a079-ae079a72c0c6",
    "repository_commit": "ab71da9cc9056eccc29c99c98117c3d84c2d99aa"
  },
  "recorded_by": {
    "tool": "skills-workshop",
    "version": "0.1.0"
  },
  "review": {
    "state": "unreviewed"
  },
  "schema": "https://github.com/leej3/skills-workshop/schemas/memory/event-v0.schema.json",
  "skill_id": "urn:uuid:f31bc4bd-a452-47ca-9ddb-45ea6cf914b6",
  "type": "project-membership"
}
