{
  "asserted_by": {
    "id": "apm-lock",
    "kind": "tool",
    "runtime": "apm",
    "runtime_version": "0.28.0"
  },
  "evidence": [],
  "extensions": {},
  "id": "urn:uuid:5d9823cb-6a69-4beb-9a55-6a2ef5732dd0",
  "occurred_at": "2026-08-17T19:56:38Z",
  "payload": {
    "resolution_digest": "sha256:a230d5c16c866e23557b25812d262ce65e81acfe7b69d591bcb91812a79c3082",
    "skill_name": "skills-workshop",
    "state": "resolved"
  },
  "project_evidence": {
    "apm_version": "0.28.0",
    "command": [
      "apm",
      "deps",
      "list"
    ],
    "dependency_selector": "./skills/skills-workshop",
    "dirty": true,
    "lock_digest": "sha256:3a13aa2d1773b81b6ec0e18b05b5a4fa24edcb8499eaf7f716e1f571d0a55601",
    "lock_path": "apm.lock.yaml",
    "manifest_path": "apm.yml",
    "project_id": "urn:uuid:7bea25b4-8855-4e71-a079-ae079a72c0c6",
    "repository_commit": "ae66f92ab94a67e895f3ed47d23022e3ac49a023"
  },
  "recorded_by": {
    "tool": "skills-workshop",
    "version": "0.1.0"
  },
  "review": {
    "state": "unreviewed"
  },
  "schema": "https://github.com/leej3/skills-workshop/schemas/memory/event-v0.schema.json",
  "skill_id": "urn:uuid:7a5c0e4c-078e-4832-9e6d-f5c4ff0298e4",
  "type": "project-membership"
}
